feature,raw_feature_name,origin,semantic_group,type,transform_encoding,keep_glm,keep_tree,keep_nn,decision_type,decision_type_short,reason_eda,zero_as_missing,is_sparse_zero,is_momentum,apply_log,apply_winsor,target_encode,impute_strategy
HandsetPrice_q,HandsetPrice_q (Low/Mid/High/Unknown),Engineered,billing_economics,Categorical (4 levels),"Binned from HandsetPrice (terciles of non-0 values, 0->Unknown)",TRUE,TRUE,TRUE,Add (Keep),keep,"Price category of handset. In EDA, churn was highest for “Unknown” price (missing/zero) and differed across price tiers. Lower-priced device users churn slightly more on average (less investment). This feature captures device value effect and covers the large missing population via “Unknown” category.",FALSE,FALSE,FALSE,FALSE,FALSE,FALSE,most_frequent
UpgradeOverdue,UpgradeOverdue (Yes/No),Engineered,contract/lifecycle,Binary flag,From MonthsInService ≥24 AND CurrentEquipmentDays ≥500,TRUE,TRUE,TRUE,Add (Keep),keep,Indicates customers likely beyond contract and using an old device (overdue for upgrade). A strong interaction: churn is significantly higher for those who are long-tenured and on old equipment (observed uplift when combined with handset features). Retained to capture this 2D risk which neither tenure nor device age alone fully represent. (Original MonthsInService and CurrentEquipmentDays are also kept for baseline effects.),FALSE,FALSE,FALSE,FALSE,FALSE,FALSE,none
HighRiskServiceArea_flag,HighRiskServiceArea_flag (Yes/No),Engineered,geo_segmentation,Binary flag,Mark ServiceAreas with highest churn rates (top X areas),TRUE,TRUE,TRUE,Add (Keep),keep,Flags if a subscriber belongs to a location with significantly above-average churn. EDA “head/tail” analysis identified certain ServiceArea codes with churn far exceeding the norm. This condenses the geographic risk without using 747 dummies. Retained in place of raw ServiceArea to capture regional network/competition issues.,FALSE,FALSE,FALSE,FALSE,FALSE,FALSE,none
CustomerCareCalls_flag,CustomerCareCalls_flag (Yes/No),Engineered,support_retention,Binary flag,"1 if CustomerCareCalls > 0, else 0",TRUE,TRUE,TRUE,Add (Keep),keep,"Overall, customers who have at least one customer-care call show higher churn than those with no calls, indicating that the flag capturesfA5 customers who experienced some problem. However, the A5 head/tail × care-calls heatmap shows that within each ServiceArea risk group churn is slightly lower for customers who contacted care, while the absolute level remains much higher in top-5 high-churn regions. This suggests that geography is the dominant driver and care calls may be partly protective once regional risk is controlled for.",FALSE,FALSE,FALSE,FALSE,FALSE,FALSE,none
DroppedQuality_flag,DroppedQuality_flag (Yes/No),Engineered,quality_experience,Binary flag,"1 if any Dropped/Blocked/UnansweredCalls > 0, else 0",TRUE,TRUE,TRUE,Add (Keep),keep,"Indicates if the customer experienced any call quality issues in the period. Almost all customers had at least one issue (91% “Yes”), so the opposite (“No issue”) minority had a somewhat lower churn. Retained mainly to enable interaction with HighUsage_flag (see below), as its standalone predictive power is limited by the small “No issue” group.",FALSE,FALSE,FALSE,FALSE,FALSE,FALSE,none
HighUsage_flag,HighUsage_flag (Yes/No),Engineered,usage_activity,Binary flag,"1 if MonthlyMinutes in top 25% (≥723 min), else 0",TRUE,TRUE,TRUE,Add (Keep),keep,"Flags heavy usage customers. On its own, high usage does not drastically change churn (in isolation, heavy users can be loyal). However, in combination with quality issues it’s powerful: EDA heatmap showed customers who are high usage and had call issues churn at a much higher rate than others (nearly 40+% vs <30%). Kept to enable that interaction effect (and as a general control for usage level).",FALSE,FALSE,FALSE,FALSE,FALSE,FALSE,none
RetentionCalls_flag,RetentionCalls_flag (Yes/No),Engineered,support_retention,Binary flag,"1 if RetentionCalls > 0, else 0",FALSE,FALSE,FALSE,(Drop – leakage),leakage,Whether the customer ever made a retention call prior to churn. Enormously predictive but not usable (leakage): virtually a post-churn behavior marker. Churn rate among those with a retention call is significantly above baseline (indicative that they already attempted to cancel). Excluded from models.,FALSE,FALSE,FALSE,FALSE,FALSE,FALSE,none
RetentionOffersAccepted_flag,RetentionOffersAccepted_flag (Yes/No),Engineered,support_retention,Binary flag,1 if RetentionOffersAccepted > 0,FALSE,FALSE,FALSE,(Drop – leakage),leakage,Whether any retention offer was accepted. Also a leakage indicator – implies a prior save attempt. Churners with a past accepted offer still have elevated churn later. Not used in modeling (only for understanding retention efficacy).,FALSE,FALSE,FALSE,FALSE,FALSE,FALSE,none
MadeCallToRetentionTeam_flag,MadeCallToRetentionTeam_flag (Yes/No),Engineered,support_retention,Binary flag,Duplicates original (Yes/No),FALSE,FALSE,FALSE,(Drop – leakage),leakage,"Flag for calling the retention team in the current period. This is directly tied to imminent churn (if 1, churn probability is extremely high, essentially an outcome). Left out of all predictive models to prevent leakage.",FALSE,FALSE,FALSE,FALSE,FALSE,FALSE,none
ServiceArea head/tail × CustomerCareCalls,ServiceArea head/tail × CustomerCareCalls（interaction）,Engineered,,,,FALSE,FALSE,FALSE,Drop,drop,"Built only for EDA as a 3×2 cross of ServiceArea_headtail and CustomerCareCalls_flag. The A5 heatmap shows that churn is highest in top-5 high-churn areas regardless of contact, and that within each group customers who contacted care churn slightly less. Because the heterogeneous effect is modest and largely captured by the main effects, we do not include this interaction as a core modeling feature; it remains an optional extension for future work.",FALSE,FALSE,FALSE,FALSE,FALSE,FALSE,none
DroppedQuality × HighUsage,DroppedQuality × HighUsage (interaction),Engineered,quality × usage,Binary interaction,1 if DroppedQuality_flag = 1 and HighUsage_flag = 1; 0 otherwise,TRUE,FALSE,TRUE,Optional (GLM/NN; not used in tree),keep,"Engineered as an indicator for heavy users who also experienced any quality issue. The A5 DroppedQuality × HighUsage heatmap shows that this group does **not** have the highest churn; if anything, their churn rate is slightly lower than that of normal/low-usage customers with no recorded issues. Thus, this interaction does not capture a “super-risky” synergy, but it may help GLM and NN model a potential **negative** interaction (engaged but complaining customers may be more likely to stay than silent low-usage customers). For tree-based models, this interaction is left implicit, as trees can learn it directly from DroppedQuality_flag and HighUsage_flag. |",FALSE,FALSE,FALSE,FALSE,FALSE,FALSE,none
SilentChurn_flag,SilentChurn_flag,Engineered (proposed),Service quality × Usage,Binary,Derived flag: 1 if HighUsage_flag = 0 and DroppedQuality_flag = 0; 0 otherwise | Y | Y | Y | Add (new feature),FALSE,FALSE,FALSE,"Drop (exploratory only, not used)",drop,"Initially proposed to capture “silent churners” with low usage and no recorded quality issues. However, when applied to the cleaned modelling data, this definition produced a degenerate feature with no observations coded as 1 (all customers fall into the 0 category). Because the flag has no variation and adds no predictive signal beyond HighUsage_flag and DroppedQuality_flag, it is documented as an exploratory attempt but excluded from all predictive models. |",FALSE,FALSE,FALSE,FALSE,FALSE,FALSE,none